{
  "approved_at": "2026-08-18T21:29:00Z",
  "approved_by": "Joseph (@Prometheus-Frameworks)",
  "authority_ceiling": "research_custody_only",
  "budget": {
    "evidence_objects": 24,
    "tool_calls": 200,
    "wall_clock_minutes": 120
  },
  "capabilities": {
    "network": "denied",
    "repository_read": [
      "authority",
      "docs",
      "preflight/keenan-allen-ind-signing-v0",
      "runs/keenan-allen-ind-signing-v0",
      "schemas",
      "src"
    ],
    "repository_write": [
      "runs/keenan-allen-ind-signing-v0/attempts",
      "runs/keenan-allen-ind-signing-v0/run-events.jsonl"
    ],
    "tools": [
      "file-read",
      "file-write-run-scope"
    ]
  },
  "cutoff_at": "2026-08-18T21:27:16Z",
  "decision_ref": "Prometheus-Frameworks/TIBER-Research#13 operator direction, 2026-08-18 (in-session); verbatim direction retained at preflight/keenan-allen-ind-signing-v0/authority/operator-direction-2026-08-18.json",
  "decision_type": "activate_run",
  "exclusions": [
    "No downstream inference of role, alignment, usage, or fantasy effect for any player.",
    "No promotion or publication of the candidate record; promotion remains a separate TIBER-Data governance decision.",
    "No network access, source acquisition, or evidence beyond the frozen inputs manifest.",
    "Stop at the independent review boundary; the executor may not author the review or the seal."
  ],
  "inputs_ref": {
    "digest": "sha256:8dc64b58d70632269456be4a5ccb2b9508d6860b54bc658e57d3081a1a371ce7",
    "digest_mode": "tiber-canonical-json-v1",
    "path": "runs/keenan-allen-ind-signing-v0/inputs.json"
  },
  "job_ref": {
    "digest": "sha256:076648700709e2bd50d00a15c758d08d2d5c43a892d657724bbc46145c707d42",
    "digest_mode": "tiber-raw-sha256-v1",
    "job_id": "keenan-allen-ind-signing",
    "job_version": "v1",
    "path": "preflight/keenan-allen-ind-signing-v0/candidate/job.yaml"
  },
  "permitted_branch": "claude/tiber-research-issue-13-audit-hjva4p",
  "permitted_path": "runs/keenan-allen-ind-signing-v0/attempts",
  "run_id": "keenan-allen-ind-signing-v0",
  "schema_version": "research-authority-decision/v0",
  "scope": "Activate the bounded keenan-allen-ind-signing-v0 Research run against the frozen job and inputs digests, through packet and submission completion only, stopping before the independent review step.",
  "synthetic_fixture": false
}
