{
  "approved_at": "2026-01-01T14:12:00Z",
  "approved_by": "synthetic-fixture-operator",
  "authority_ceiling": "research_custody_only",
  "budget": {
    "evidence_objects": 1,
    "tool_calls": 4,
    "wall_clock_minutes": 10
  },
  "capabilities": {
    "network": "denied",
    "repository_read": [
      "authority/decision.json",
      "job.yaml",
      "runs/run-synthetic-001"
    ],
    "repository_write": [
      "runs/run-synthetic-001/run-events.jsonl",
      "runs/run-synthetic-001/attempts"
    ],
    "tools": [
      "fixture-reader",
      "deterministic-calculator"
    ]
  },
  "cutoff_at": "2026-01-02T00:00:00Z",
  "decision_ref": "synthetic:stage0-fixture-authorization",
  "decision_type": "activate_run",
  "exclusions": [
    "No real-world evidence, football claims, downstream authority, promotion, publication, or source acquisition."
  ],
  "inputs_ref": {
    "digest": "sha256:c01f24e73732396585447e8a881e92b3222ddc9d2d1bfff338b9c6232286f7db",
    "digest_mode": "tiber-canonical-json-v1",
    "path": "runs/run-synthetic-001/inputs.json"
  },
  "job_ref": {
    "digest": "sha256:4ef609ca1882429e7606e97bd6af67120c9eb332ae15f37574ac7de1a71f32b5",
    "digest_mode": "tiber-raw-sha256-v1",
    "job_id": "synthetic-reliability-check",
    "job_version": "v1",
    "path": "job.yaml"
  },
  "permitted_branch": "synthetic/stage0-fixture",
  "permitted_path": "runs/run-synthetic-001/attempts",
  "run_id": "run-synthetic-001",
  "schema_version": "research-authority-decision/v0",
  "scope": "Authorize one synthetic, file-backed Stage 0 conformance run over the frozen fictional device fixture.",
  "synthetic_fixture": true
}
